"Status","Start Time","Stop Time","Duration in ms","Parent Suite","Suite","Sub Suite","Test Class","Test Method","Name","Description"
"passed","Tue Nov 23 15:53:41 GMT 2021","Tue Nov 23 15:53:52 GMT 2021","10677","","Contract: TimersTimestamp","","Contract: TimersTimestamp","pending","pending",""
"passed","Tue Nov 23 15:51:32 GMT 2021","Tue Nov 23 15:51:39 GMT 2021","7052","","Contract: EnumerableSet EnumerableBytes32Set","","Contract: EnumerableSet EnumerableBytes32Set","starts empty","starts empty",""
"passed","Tue Nov 23 15:49:02 GMT 2021","Tue Nov 23 15:49:49 GMT 2021","46738","","Contract: PaymentSplitter once deployed distributes funds to payees","","Contract: PaymentSplitter once deployed distributes funds to payees","Token","Token",""
"passed","Tue Nov 23 15:54:46 GMT 2021","Tue Nov 23 15:54:59 GMT 2021","12942","","Contract: Address functionDelegateCall","","Contract: Address functionDelegateCall","delegate calls the requested function","delegate calls the requested function",""
"passed","Tue Nov 23 15:47:57 GMT 2021","Tue Nov 23 15:48:10 GMT 2021","12580","","Contract: MinimalForwarder with message execute invalid signature","","Contract: MinimalForwarder with message execute invalid signature","tampered from","tampered from",""
"passed","Tue Nov 23 15:51:43 GMT 2021","Tue Nov 23 15:51:48 GMT 2021","4753","","Contract: Math ceilDiv","","Contract: Math ceilDiv","rounds up on division with remainders","rounds up on division with remainders",""
"passed","Tue Nov 23 15:52:35 GMT 2021","Tue Nov 23 15:52:47 GMT 2021","11920","","Contract: Address functionCall with valid contract receiver","","Contract: Address functionCall with valid contract receiver","calls the requested function","calls the requested function",""
"passed","Tue Nov 23 15:54:29 GMT 2021","Tue Nov 23 15:54:48 GMT 2021","18971","","Contract: Counters decrement after incremented to 3","","Contract: Counters decrement after incremented to 3","can be called multiple times","can be called multiple times",""
"passed","Tue Nov 23 15:51:01 GMT 2021","Tue Nov 23 15:51:07 GMT 2021","5522","","Contract: ERC165Storage","","Contract: ERC165Storage","does not allow 0xffffffff","does not allow 0xffffffff",""
"passed","Tue Nov 23 15:54:48 GMT 2021","Tue Nov 23 15:54:54 GMT 2021","6288","","Contract: Counters reset null counter","","Contract: Counters reset null counter","does not throw","does not throw",""
"skipped","Tue Nov 23 15:47:39 GMT 2021","Tue Nov 23 15:47:39 GMT 2021","0","","Contract: TimelockController methods operation hashing","","Contract: TimelockController methods operation hashing","hashOperation","hashOperation",""
"passed","Tue Nov 23 15:53:19 GMT 2021","Tue Nov 23 15:53:26 GMT 2021","6475","","Contract: EnumerableMap read get","","Contract: EnumerableMap read get","missing value","missing value",""
"passed","Tue Nov 23 15:49:47 GMT 2021","Tue Nov 23 15:49:52 GMT 2021","5218","","Contract: ERC1967Proxy initialization without parameters non payable when not sending balance","","Contract: ERC1967Proxy initialization without parameters non payable when not sending balance","has expected balance","has expected balance",""
"passed","Tue Nov 23 15:52:06 GMT 2021","Tue Nov 23 15:52:11 GMT 2021","4718","","Contract: SafeMath with flag mod modulos correctly","","Contract: SafeMath with flag mod modulos correctly","when the dividend is larger than the divisor","when the dividend is larger than the divisor",""
"broken","Tue Nov 23 15:53:54 GMT 2021","Tue Nov 23 15:54:02 GMT 2021","8831","","Contract: Address functionCallWithValue with non-zero value","","Contract: Address functionCallWithValue with non-zero value","reverts when calling non-payable functions","reverts when calling non-payable functions",""
"passed","Tue Nov 23 15:47:15 GMT 2021","Tue Nov 23 15:47:21 GMT 2021","6260","","Contract: MinimalForwarder with message verify invalid signature","","Contract: MinimalForwarder with message verify invalid signature","tampered value","tampered value",""
"passed","Tue Nov 23 15:53:50 GMT 2021","Tue Nov 23 15:53:55 GMT 2021","5814","","Contract: Escrow as an escrow deposits","","Contract: Escrow as an escrow deposits","emits a deposited event","emits a deposited event",""
"passed","Tue Nov 23 15:53:05 GMT 2021","Tue Nov 23 15:53:10 GMT 2021","5015","","Contract: SafeCast toUint128","","Contract: SafeCast toUint128","downcasts 1","downcasts 1",""
"passed","Tue Nov 23 15:51:27 GMT 2021","Tue Nov 23 15:51:37 GMT 2021","9557","","Contract: Clones cloneDeterministic initialization without parameters non payable when not sending balance","","Contract: Clones cloneDeterministic initialization without parameters non payable when not sending balance","initializes the proxy","initializes the proxy",""
"failed","Tue Nov 23 15:51:00 GMT 2021","Tue Nov 23 15:51:09 GMT 2021","8679","","Contract: Clones clone initialization with parameters payable when sending some balance","","Contract: Clones clone initialization with parameters payable when sending some balance","has expected balance","has expected balance",""
"passed","Tue Nov 23 15:49:49 GMT 2021","Tue Nov 23 15:50:02 GMT 2021","12567","","Contract: UpgradeableBeacon once deployed","","Contract: UpgradeableBeacon once deployed","cannot be upgraded by other account","cannot be upgraded by other account",""
"passed","Tue Nov 23 15:49:04 GMT 2021","Tue Nov 23 15:49:09 GMT 2021","5110","","Contract: Initializable basic testing without inheritance before initialize","","Contract: Initializable basic testing without inheritance before initialize","initializer has not run","initializer has not run",""
"passed","Tue Nov 23 15:49:18 GMT 2021","Tue Nov 23 15:49:25 GMT 2021","6625","","Contract: TransparentUpgradeableProxy","","Contract: TransparentUpgradeableProxy","cannot be initialized with a non-contract address","cannot be initialized with a non-contract address",""
"skipped","Tue Nov 23 15:51:29 GMT 2021","Tue Nov 23 15:51:29 GMT 2021","0","","Contract: TransparentUpgradeableProxy initialization with parameters non payable when not sending balance","","Contract: TransparentUpgradeableProxy initialization with parameters non payable when not sending balance","sets the implementation address","sets the implementation address",""
"passed","Tue Nov 23 15:51:03 GMT 2021","Tue Nov 23 15:51:07 GMT 2021","4311","","Contract: SafeMath with flag add","","Contract: SafeMath with flag add","adds correctly","adds correctly",""
"failed","Tue Nov 23 15:49:15 GMT 2021","Tue Nov 23 15:49:17 GMT 2021","1929","","Contract: UpgradeableBeacon","","Contract: UpgradeableBeacon","cannot be created with non-contract implementation","cannot be created with non-contract implementation",""
"broken","Tue Nov 23 15:54:24 GMT 2021","Tue Nov 23 15:54:29 GMT 2021","5582","","Contract: Escrow as an escrow withdrawals","","Contract: Escrow as an escrow withdrawals","emits a withdrawn event","emits a withdrawn event",""
"passed","Tue Nov 23 15:47:24 GMT 2021","Tue Nov 23 15:47:38 GMT 2021","13514","","Contract: PaymentSplitter once deployed shares","","Contract: PaymentSplitter once deployed shares","stores shares if address is payee","stores shares if address is payee",""
"skipped","Tue Nov 23 15:47:39 GMT 2021","Tue Nov 23 15:47:39 GMT 2021","0","","Contract: TimelockController methods batch schedule","","Contract: TimelockController methods batch schedule","proposer can schedule","proposer can schedule",""
"passed","Tue Nov 23 15:50:33 GMT 2021","Tue Nov 23 15:50:42 GMT 2021","9502","","Contract: Clones clone initialization with parameters payable when not sending balance","","Contract: Clones clone initialization with parameters payable when not sending balance","initializes the proxy","initializes the proxy",""
"passed","Tue Nov 23 15:54:06 GMT 2021","Tue Nov 23 15:54:13 GMT 2021","6701","","Contract: EnumerableSet EnumerableUintSet remove","","Contract: EnumerableSet EnumerableUintSet remove","returns false when removing values not in the set","returns false when removing values not in the set",""
"passed","Tue Nov 23 15:50:08 GMT 2021","Tue Nov 23 15:50:14 GMT 2021","5952","","Contract: ERC1967Proxy initialization without parameters payable when sending some balance","","Contract: ERC1967Proxy initialization without parameters payable when sending some balance","initializes the proxy","initializes the proxy",""
"passed","Tue Nov 23 15:52:34 GMT 2021","Tue Nov 23 15:53:09 GMT 2021","35507","","Contract: EnumerableSet EnumerableBytes32Set remove","","Contract: EnumerableSet EnumerableBytes32Set remove","adds and removes multiple values","adds and removes multiple values",""
"failed","Tue Nov 23 15:50:21 GMT 2021","Tue Nov 23 15:51:21 GMT 2021","60400","tests.truffle","test_truffle","","","","test_truffle_test",""
"skipped","Tue Nov 23 15:47:39 GMT 2021","Tue Nov 23 15:47:39 GMT 2021","0","","Contract: TimelockController methods batch execute","","Contract: TimelockController methods batch execute","revert if operation is not scheduled","revert if operation is not scheduled",""
"skipped","Tue Nov 23 15:47:39 GMT 2021","Tue Nov 23 15:47:39 GMT 2021","0","","Contract: TimelockController methods simple execute with scheduled operation","","Contract: TimelockController methods simple execute with scheduled operation","revert if execution comes too early 2/2","revert if execution comes too early 2/2",""
"failed","Tue Nov 23 15:51:14 GMT 2021","Tue Nov 23 15:51:21 GMT 2021","6785","","Contract: TimersBlockNumber","","Contract: TimersBlockNumber","fast forward","fast forward",""
"skipped","Tue Nov 23 15:47:39 GMT 2021","Tue Nov 23 15:47:39 GMT 2021","0","","Contract: TimelockController methods cancel","","Contract: TimelockController methods cancel","proposer can cancel","proposer can cancel",""
"passed","Tue Nov 23 15:52:57 GMT 2021","Tue Nov 23 15:53:04 GMT 2021","7097","","Contract: Arrays findUpperBound Odd number of elements","","Contract: Arrays findUpperBound Odd number of elements","returns first index after last element if searched value is over the upper boundary","returns first index after last element if searched value is over the upper boundary",""
"passed","Tue Nov 23 15:51:37 GMT 2021","Tue Nov 23 15:51:43 GMT 2021","5903","","Contract: SignedSafeMath add","","Contract: SignedSafeMath add","reverts on positive addition overflow","reverts on positive addition overflow",""
"passed","Tue Nov 23 15:50:19 GMT 2021","Tue Nov 23 15:50:26 GMT 2021","6418","","Contract: ERC1967Proxy initialization with parameters non payable when not sending balance","","Contract: ERC1967Proxy initialization with parameters non payable when not sending balance","initializes the proxy","initializes the proxy",""
"passed","Tue Nov 23 15:53:12 GMT 2021","Tue Nov 23 15:53:25 GMT 2021","12960","","Contract: Address functionCallWithValue with zero value","","Contract: Address functionCallWithValue with zero value","calls the requested function","calls the requested function",""
"passed","Tue Nov 23 15:54:12 GMT 2021","Tue Nov 23 15:54:18 GMT 2021","5946","","Contract: Escrow as an escrow withdrawals","","Contract: Escrow as an escrow withdrawals","can do an empty withdrawal","can do an empty withdrawal",""
"passed","Tue Nov 23 15:53:52 GMT 2021","Tue Nov 23 15:54:02 GMT 2021","10597","","Contract: TimersTimestamp","","Contract: TimersTimestamp","expired","expired",""
"broken","Tue Nov 23 15:48:48 GMT 2021","Tue Nov 23 15:49:02 GMT 2021","13436","","Contract: PaymentSplitter once deployed distributes funds to payees","","Contract: PaymentSplitter once deployed distributes funds to payees","Ether","Ether",""
"passed","Tue Nov 23 15:52:51 GMT 2021","Tue Nov 23 15:52:55 GMT 2021","4769","","Contract: SafeCast toUint96","","Contract: SafeCast toUint96","reverts when downcasting 2^96 (79228162514264337593543950336)","reverts when downcasting 2^96 (79228162514264337593543950336)",""
"passed","Tue Nov 23 15:52:22 GMT 2021","Tue Nov 23 15:52:26 GMT 2021","4664","","Contract: SafeCast toUint64","","Contract: SafeCast toUint64","downcasts 2^64 - 1 (18446744073709551615)","downcasts 2^64 - 1 (18446744073709551615)",""
"passed","Tue Nov 23 15:54:50 GMT 2021","Tue Nov 23 15:54:56 GMT 2021","6366","","Contract: StorageSlot bytes32 storage slot get","","Contract: StorageSlot bytes32 storage slot get","from other slot","from other slot",""
"passed","Tue Nov 23 15:50:43 GMT 2021","Tue Nov 23 15:50:49 GMT 2021","5781","","Contract: ERC1967Proxy initialization with parameters payable when not sending balance","","Contract: ERC1967Proxy initialization with parameters payable when not sending balance","has expected balance","has expected balance",""
"passed","Tue Nov 23 15:53:55 GMT 2021","Tue Nov 23 15:54:06 GMT 2021","10663","","Contract: EnumerableSet EnumerableUintSet remove","","Contract: EnumerableSet EnumerableUintSet remove","removes added values","removes added values",""
"passed","Tue Nov 23 15:50:59 GMT 2021","Tue Nov 23 15:51:04 GMT 2021","5274","","Contract: SafeCast toUint8","","Contract: SafeCast toUint8","downcasts 0","downcasts 0",""
"passed","Tue Nov 23 15:55:08 GMT 2021","Tue Nov 23 15:55:16 GMT 2021","7810","","Contract: StorageSlot uint256 storage slot get","","Contract: StorageSlot uint256 storage slot get","from other slot","from other slot",""
"broken","Tue Nov 23 15:46:55 GMT 2021","Tue Nov 23 15:47:08 GMT 2021","13829","","Contract: PaymentSplitter once deployed accepts payments","","Contract: PaymentSplitter once deployed accepts payments","Ether","Ether",""
"passed","Tue Nov 23 15:49:29 GMT 2021","Tue Nov 23 15:49:37 GMT 2021","8099","","Contract: Initializable complex testing with inheritance","","Contract: Initializable complex testing with inheritance","initializes human","initializes human",""
"passed","Tue Nov 23 15:52:07 GMT 2021","Tue Nov 23 15:52:13 GMT 2021","5730","","Contract: SignedSafeMath mul","","Contract: SignedSafeMath mul","multiplies correctly","multiplies correctly",""
"passed","Tue Nov 23 15:53:39 GMT 2021","Tue Nov 23 15:53:44 GMT 2021","5666","","Contract: Escrow as an escrow deposits","","Contract: Escrow as an escrow deposits","can accept an empty deposit","can accept an empty deposit",""
"passed","Tue Nov 23 15:51:14 GMT 2021","Tue Nov 23 15:51:19 GMT 2021","5036","","Contract: SafeCast toUint8","","Contract: SafeCast toUint8","reverts when downcasting 2^8 (256)","reverts when downcasting 2^8 (256)",""
"passed","Tue Nov 23 15:51:02 GMT 2021","Tue Nov 23 15:51:15 GMT 2021","13048","","Contract: Context msgData","","Contract: Context msgData","returns the transaction sender when from another contract","returns the transaction sender when from another contract",""
"passed","Tue Nov 23 15:51:19 GMT 2021","Tue Nov 23 15:51:24 GMT 2021","5081","","Contract: SafeCast toUint8","","Contract: SafeCast toUint8","reverts when downcasting 2^8 + 1 (257)","reverts when downcasting 2^8 + 1 (257)",""
"failed","Tue Nov 23 15:48:16 GMT 2021","Tue Nov 23 15:48:29 GMT 2021","12565","tests.openzeppelin","test_openzeppelin","","","","test_contracts[input_data0]",""
"passed","Tue Nov 23 15:50:47 GMT 2021","Tue Nov 23 15:50:51 GMT 2021","4676","","Contract: ERC165 Contract interface ERC165 ERC165's supportsInterface(bytes4)","","Contract: ERC165 Contract interface ERC165 ERC165's supportsInterface(bytes4)","claims support [skip-on-coverage]","claims support [skip-on-coverage]",""
"skipped","Tue Nov 23 15:47:39 GMT 2021","Tue Nov 23 15:47:39 GMT 2021","0","","Contract: TimelockController methods simple schedule","","Contract: TimelockController methods simple schedule","prevent non-proposer from commiting","prevent non-proposer from commiting",""
"broken","Tue Nov 23 15:47:39 GMT 2021","Tue Nov 23 15:47:51 GMT 2021","12320","","Contract: GovernorCompatibilityBravo nominal","","Contract: GovernorCompatibilityBravo nominal","run","run",""
"skipped","Tue Nov 23 15:47:39 GMT 2021","Tue Nov 23 15:47:39 GMT 2021","0","","Contract: TimelockController methods simple execute","","Contract: TimelockController methods simple execute","revert if operation is not scheduled","revert if operation is not scheduled",""
"passed","Tue Nov 23 15:52:37 GMT 2021","Tue Nov 23 15:52:43 GMT 2021","5829","","Contract: SafeMath with default revert message mul","","Contract: SafeMath with default revert message mul","multiplies correctly","multiplies correctly",""
"failed","Tue Nov 23 15:49:25 GMT 2021","Tue Nov 23 15:49:33 GMT 2021","7777","","Contract: Clones clone initialization without parameters non payable when sending some balance","","Contract: Clones clone initialization without parameters non payable when sending some balance","reverts","reverts",""
"passed","Tue Nov 23 15:52:12 GMT 2021","Tue Nov 23 15:52:17 GMT 2021","4918","","Contract: SafeCast toUint64","","Contract: SafeCast toUint64","downcasts 0","downcasts 0",""
"passed","Tue Nov 23 15:50:03 GMT 2021","Tue Nov 23 15:50:12 GMT 2021","9521","","Contract: ProxyAdmin #getProxyImplementation","","Contract: ProxyAdmin #getProxyImplementation","returns proxy implementation address","returns proxy implementation address",""
"passed","Tue Nov 23 15:49:08 GMT 2021","Tue Nov 23 15:49:17 GMT 2021","8572","","Contract: Clones clone initialization without parameters non payable when not sending balance","","Contract: Clones clone initialization without parameters non payable when not sending balance","initializes the proxy","initializes the proxy",""
"broken","Tue Nov 23 15:44:13 GMT 2021","Tue Nov 23 15:44:14 GMT 2021","856","Ethers.js","","","","","shouldCreateAcccountWithEthersJs",""
"failed","Tue Nov 23 15:49:36 GMT 2021","Tue Nov 23 15:49:41 GMT 2021","4912","","Contract: ERC1967Proxy without initialization when sending some balance","","Contract: ERC1967Proxy without initialization when sending some balance","has expected balance","has expected balance",""
"passed","Tue Nov 23 15:44:21 GMT 2021","Tue Nov 23 15:44:21 GMT 2021","8","Ethers.js","","","","","testContracts",""
"failed","Tue Nov 23 15:49:58 GMT 2021","Tue Nov 23 15:50:06 GMT 2021","8134","","Contract: Clones clone initialization without parameters payable when sending some balance","","Contract: Clones clone initialization without parameters payable when sending some balance","has expected balance","has expected balance",""
"skipped","Tue Nov 23 15:47:39 GMT 2021","Tue Nov 23 15:47:39 GMT 2021","0","","Contract: TimelockController maintenance","","Contract: TimelockController maintenance","timelock scheduled maintenance","timelock scheduled maintenance",""
"failed","Tue Nov 23 15:46:25 GMT 2021","Tue Nov 23 15:46:27 GMT 2021","1773","","Contract: PaymentSplitter","","Contract: PaymentSplitter","rejects repeated payees","rejects repeated payees",""
"skipped","Tue Nov 23 15:47:39 GMT 2021","Tue Nov 23 15:47:39 GMT 2021","0","","Contract: TimelockController usage scenario","","Contract: TimelockController usage scenario","call reverting with eth","call reverting with eth",""
"passed","Tue Nov 23 15:53:58 GMT 2021","Tue Nov 23 15:54:04 GMT 2021","5814","","Contract: StorageSlot boolean storage slot","","Contract: StorageSlot boolean storage slot","set","set",""
"passed","Tue Nov 23 15:52:50 GMT 2021","Tue Nov 23 15:52:57 GMT 2021","6951","","Contract: Arrays findUpperBound Odd number of elements","","Contract: Arrays findUpperBound Odd number of elements","returns index of the last element","returns index of the last element",""
"skipped","Tue Nov 23 15:51:05 GMT 2021","Tue Nov 23 15:51:05 GMT 2021","0","","Contract: TransparentUpgradeableProxy initialization without parameters payable when sending some balance","","Contract: TransparentUpgradeableProxy initialization without parameters payable when sending some balance","sets the implementation address","sets the implementation address",""
"skipped","Tue Nov 23 15:48:16 GMT 2021","Tue Nov 23 15:48:16 GMT 2021","0","tests.hardhat","test_hardhat","","","","test_hardhat_advanced",""
"skipped","Tue Nov 23 15:47:39 GMT 2021","Tue Nov 23 15:47:39 GMT 2021","0","","Contract: TimelockController usage scenario","","Contract: TimelockController usage scenario","call out of gas","call out of gas",""
"passed","Tue Nov 23 15:50:52 GMT 2021","Tue Nov 23 15:51:00 GMT 2021","7724","","Contract: ERC1820Implementer with registered interfaces","","Contract: ERC1820Implementer with registered interfaces","returns false when interface implementation for non-supported interfaces is queried","returns false when interface implementation for non-supported interfaces is queried",""
"passed","Tue Nov 23 15:51:43 GMT 2021","Tue Nov 23 15:51:48 GMT 2021","5315","","Contract: SignedSafeMath add","","Contract: SignedSafeMath add","reverts on negative addition overflow","reverts on negative addition overflow",""
"passed","Tue Nov 23 15:51:48 GMT 2021","Tue Nov 23 15:51:53 GMT 2021","4605","","Contract: SafeCast toUint32","","Contract: SafeCast toUint32","downcasts 0","downcasts 0",""
"passed","Tue Nov 23 15:49:50 GMT 2021","Tue Nov 23 15:49:58 GMT 2021","8563","","Contract: Clones clone initialization without parameters payable when sending some balance","","Contract: Clones clone initialization without parameters payable when sending some balance","initializes the proxy","initializes the proxy",""
"failed","Tue Nov 23 15:51:07 GMT 2021","Tue Nov 23 15:51:12 GMT 2021","4794","","Contract: ERC165Storage Contract interface ERC165 ERC165's supportsInterface(bytes4)","","Contract: ERC165Storage Contract interface ERC165 ERC165's supportsInterface(bytes4)","uses less than 30k gas [skip-on-coverage]","uses less than 30k gas [skip-on-coverage]",""
"passed","Tue Nov 23 15:49:26 GMT 2021","Tue Nov 23 15:49:40 GMT 2021","14050","","Contract: UpgradeableBeacon once deployed","","Contract: UpgradeableBeacon once deployed","can be upgraded by the owner","can be upgraded by the owner",""
"passed","Tue Nov 23 15:44:16 GMT 2021","Tue Nov 23 15:44:17 GMT 2021","1168","Ethers.js","","","","","shouldConnectViaEthersJs",""
"passed","Tue Nov 23 15:53:12 GMT 2021","Tue Nov 23 15:53:18 GMT 2021","5960","","Contract: EnumerableSet EnumerableUintSet","","Contract: EnumerableSet EnumerableUintSet","starts empty","starts empty",""
"failed","Tue Nov 23 15:49:33 GMT 2021","Tue Nov 23 15:50:21 GMT 2021","47622","tests.truffle","test_truffle","","","","test_truffle_contract",""
"passed","Tue Nov 23 15:49:35 GMT 2021","Tue Nov 23 15:49:46 GMT 2021","10289","","Contract: TransparentUpgradeableProxy without initialization when not sending balance","","Contract: TransparentUpgradeableProxy without initialization when not sending balance","has expected balance","has expected balance",""
"broken","Tue Nov 23 15:47:39 GMT 2021","Tue Nov 23 15:48:39 GMT 2021","59525","","Contract: GovernorComp voting with comp token","","Contract: GovernorComp voting with comp token","run","run",""
"passed","Tue Nov 23 15:49:41 GMT 2021","Tue Nov 23 15:49:47 GMT 2021","5614","","Contract: ERC1967Proxy initialization without parameters non payable when not sending balance","","Contract: ERC1967Proxy initialization without parameters non payable when not sending balance","initializes the proxy","initializes the proxy",""
"passed","Tue Nov 23 15:53:40 GMT 2021","Tue Nov 23 15:53:51 GMT 2021","11240","","Contract: EnumerableSet EnumerableUintSet add","","Contract: EnumerableSet EnumerableUintSet add","returns false when adding values already in the set","returns false when adding values already in the set",""
"passed","Tue Nov 23 15:52:41 GMT 2021","Tue Nov 23 15:52:46 GMT 2021","5084","","Contract: SafeCast toUint96","","Contract: SafeCast toUint96","downcasts 1","downcasts 1",""
"passed","Tue Nov 23 15:47:43 GMT 2021","Tue Nov 23 15:47:57 GMT 2021","13758","","Contract: MinimalForwarder with message execute valid signature","","Contract: MinimalForwarder with message execute valid signature","success","success",""
"skipped","Tue Nov 23 15:49:20 GMT 2021","Tue Nov 23 15:49:20 GMT 2021","0","","Contract: ERC1967Proxy without initialization when not sending balance","","Contract: ERC1967Proxy without initialization when not sending balance","sets the implementation address","sets the implementation address",""
"skipped","Tue Nov 23 15:50:37 GMT 2021","Tue Nov 23 15:50:37 GMT 2021","0","","Contract: ERC1967Proxy initialization with parameters payable when not sending balance","","Contract: ERC1967Proxy initialization with parameters payable when not sending balance","sets the implementation address","sets the implementation address",""
"passed","Tue Nov 23 15:53:32 GMT 2021","Tue Nov 23 15:53:41 GMT 2021","8887","","Contract: TimersTimestamp","","Contract: TimersTimestamp","unset","unset",""
"passed","Tue Nov 23 15:53:04 GMT 2021","Tue Nov 23 15:53:11 GMT 2021","7182","","Contract: Arrays findUpperBound Odd number of elements","","Contract: Arrays findUpperBound Odd number of elements","returns 0 for the element under the lower boundary","returns 0 for the element under the lower boundary",""
"passed","Tue Nov 23 15:49:18 GMT 2021","Tue Nov 23 15:49:20 GMT 2021","1554","","Contract: ERC1967Proxy","","Contract: ERC1967Proxy","cannot be initialized with a non-contract address","cannot be initialized with a non-contract address",""
"failed","Tue Nov 23 15:54:13 GMT 2021","Tue Nov 23 15:54:23 GMT 2021","10054","","Contract: TimersTimestamp","","Contract: TimersTimestamp","fast forward","fast forward",""
"passed","Tue Nov 23 15:52:54 GMT 2021","Tue Nov 23 15:52:59 GMT 2021","4716","","Contract: SafeMath with default revert message div","","Contract: SafeMath with default revert message div","divides correctly","divides correctly",""
"passed","Tue Nov 23 15:49:41 GMT 2021","Tue Nov 23 15:49:50 GMT 2021","8237","","Contract: Clones clone initialization without parameters payable when not sending balance","","Contract: Clones clone initialization without parameters payable when not sending balance","has expected balance","has expected balance",""
