"Status","Start Time","Stop Time","Duration in ms","Parent Suite","Suite","Sub Suite","Test Class","Test Method","Name","Description"
"passed","Tue Nov 23 15:48:24 GMT 2021","Tue Nov 23 15:48:30 GMT 2021","6594","","Contract: MinimalForwarder with message execute invalid signature","","Contract: MinimalForwarder with message execute invalid signature","tampered nonce","tampered nonce",""
"passed","Tue Nov 23 15:49:32 GMT 2021","Tue Nov 23 15:49:44 GMT 2021","12301","","Contract: UUPSUpgradeable","","Contract: UUPSUpgradeable","upgrade to upgradeable implementation with call","upgrade to upgradeable implementation with call",""
"passed","Tue Nov 23 15:51:58 GMT 2021","Tue Nov 23 15:52:02 GMT 2021","4831","","Contract: SafeCast toUint32","","Contract: SafeCast toUint32","downcasts 2^32 - 1 (4294967295)","downcasts 2^32 - 1 (4294967295)",""
"skipped","Tue Nov 23 15:47:39 GMT 2021","Tue Nov 23 15:47:39 GMT 2021","0","","Contract: TimelockController methods batch execute with scheduled operation","","Contract: TimelockController methods batch execute with scheduled operation","revert if execution comes too early 1/2","revert if execution comes too early 1/2",""
"failed","Tue Nov 23 15:51:53 GMT 2021","Tue Nov 23 15:52:05 GMT 2021","11509","","Contract: TransparentUpgradeableProxy initialization with parameters non payable when sending some balance","","Contract: TransparentUpgradeableProxy initialization with parameters non payable when sending some balance","reverts","reverts",""
"passed","Tue Nov 23 15:52:35 GMT 2021","Tue Nov 23 15:52:40 GMT 2021","4755","","Contract: SignedSafeMath div","","Contract: SignedSafeMath div","divides zero correctly","divides zero correctly",""
"passed","Tue Nov 23 15:53:42 GMT 2021","Tue Nov 23 15:53:48 GMT 2021","5992","","Contract: RefundEscrow once deployed active state","","Contract: RefundEscrow once deployed active state","has beneficiary and state","has beneficiary and state",""
"skipped","Tue Nov 23 15:47:39 GMT 2021","Tue Nov 23 15:47:39 GMT 2021","0","","Contract: TimelockController methods operation hashing","","Contract: TimelockController methods operation hashing","hashOperationBatch","hashOperationBatch",""
"passed","Tue Nov 23 15:46:47 GMT 2021","Tue Nov 23 15:46:55 GMT 2021","8282","","Contract: MinimalForwarder with message verify valid signature","","Contract: MinimalForwarder with message verify valid signature","success","success",""
"passed","Tue Nov 23 15:54:59 GMT 2021","Tue Nov 23 15:55:07 GMT 2021","8468","","Contract: Address functionDelegateCall","","Contract: Address functionDelegateCall","bubbles up revert reason","bubbles up revert reason",""
"failed","Tue Nov 23 15:50:43 GMT 2021","Tue Nov 23 15:50:53 GMT 2021","9785","","Contract: TimersBlockNumber","","Contract: TimersBlockNumber","pending","pending",""
"passed","Tue Nov 23 15:49:12 GMT 2021","Tue Nov 23 15:49:22 GMT 2021","9770","","Contract: ProxyAdmin","","Contract: ProxyAdmin","has an owner","has an owner",""
"passed","Tue Nov 23 15:52:17 GMT 2021","Tue Nov 23 15:52:29 GMT 2021","12011","","Contract: TransparentUpgradeableProxy initialization with parameters payable when not sending balance","","Contract: TransparentUpgradeableProxy initialization with parameters payable when not sending balance","has expected balance","has expected balance",""
"passed","Tue Nov 23 15:51:11 GMT 2021","Tue Nov 23 15:51:16 GMT 2021","4861","","Contract: SafeMath with flag sub","","Contract: SafeMath with flag sub","subtracts correctly","subtracts correctly",""
"broken","Tue Nov 23 15:54:13 GMT 2021","Tue Nov 23 15:54:19 GMT 2021","6000","","Contract: RefundEscrow once deployed refund state","","Contract: RefundEscrow once deployed refund state","rejects deposits","rejects deposits",""
"passed","Tue Nov 23 15:52:02 GMT 2021","Tue Nov 23 15:52:07 GMT 2021","4697","","Contract: SafeCast toUint32","","Contract: SafeCast toUint32","reverts when downcasting 2^32 (4294967296)","reverts when downcasting 2^32 (4294967296)",""
"passed","Tue Nov 23 15:49:37 GMT 2021","Tue Nov 23 15:49:45 GMT 2021","7868","","Contract: Initializable complex testing with inheritance","","Contract: Initializable complex testing with inheritance","initializes mother","initializes mother",""
"passed","Tue Nov 23 15:49:01 GMT 2021","Tue Nov 23 15:49:33 GMT 2021","32124","tests.truffle","test_truffle","","","","test_truffle_migration",""
"passed","Tue Nov 23 15:51:19 GMT 2021","Tue Nov 23 15:51:24 GMT 2021","4582","","Contract: Math average","","Contract: Math average","is correctly calculated with two odd numbers","is correctly calculated with two odd numbers",""
"passed","Tue Nov 23 15:52:35 GMT 2021","Tue Nov 23 15:52:42 GMT 2021","6673","","Contract: EnumerableMap remove","","Contract: EnumerableMap remove","returns false when removing keys not in the set","returns false when removing keys not in the set",""
"passed","Tue Nov 23 15:51:39 GMT 2021","Tue Nov 23 15:51:48 GMT 2021","9243","","Contract: EnumerableSet EnumerableBytes32Set add","","Contract: EnumerableSet EnumerableBytes32Set add","adds a value","adds a value",""
"passed","Tue Nov 23 15:53:51 GMT 2021","Tue Nov 23 15:53:58 GMT 2021","6547","","Contract: Counters increment starting from 0","","Contract: Counters increment starting from 0","increments the current value by one","increments the current value by one",""
"passed","Tue Nov 23 15:51:21 GMT 2021","Tue Nov 23 15:51:25 GMT 2021","3799","","Contract: SafeMath with flag mul","","Contract: SafeMath with flag mul","multiplies correctly","multiplies correctly",""
"passed","Tue Nov 23 15:52:10 GMT 2021","Tue Nov 23 15:52:17 GMT 2021","6524","","Contract: Arrays findUpperBound Even number of elements","","Contract: Arrays findUpperBound Even number of elements","returns 0 for the first element","returns 0 for the first element",""
"passed","Tue Nov 23 15:50:44 GMT 2021","Tue Nov 23 15:50:49 GMT 2021","4667","","Contract: MerkleProof verify","","Contract: MerkleProof verify","returns false for a Merkle proof of invalid length","returns false for a Merkle proof of invalid length",""
"failed","Tue Nov 23 15:52:54 GMT 2021","Tue Nov 23 15:53:01 GMT 2021","6999","","Contract: TransparentUpgradeableProxy initialization with parameters reverting initialization","","Contract: TransparentUpgradeableProxy initialization with parameters reverting initialization","reverts","reverts",""
"passed","Tue Nov 23 15:52:55 GMT 2021","Tue Nov 23 15:53:00 GMT 2021","4837","","Contract: SafeCast toUint96","","Contract: SafeCast toUint96","reverts when downcasting 2^96 + 1 (79228162514264337593543950337)","reverts when downcasting 2^96 + 1 (79228162514264337593543950337)",""
"passed","Tue Nov 23 15:51:58 GMT 2021","Tue Nov 23 15:52:02 GMT 2021","4787","","Contract: SignedSafeMath sub","","Contract: SignedSafeMath sub","reverts on positive subtraction overflow","reverts on positive subtraction overflow",""
"passed","Tue Nov 23 15:52:49 GMT 2021","Tue Nov 23 15:52:54 GMT 2021","5486","","Contract: SafeMath with default revert message mul","","Contract: SafeMath with default revert message mul","reverts on multiplication overflow","reverts on multiplication overflow",""
"failed","Tue Nov 23 15:46:16 GMT 2021","Tue Nov 23 15:46:18 GMT 2021","2098","","Contract: PaymentSplitter","","Contract: PaymentSplitter","rejects an empty set of payees","rejects an empty set of payees",""
"passed","Tue Nov 23 15:47:09 GMT 2021","Tue Nov 23 15:47:24 GMT 2021","15337","","Contract: PaymentSplitter once deployed accepts payments","","Contract: PaymentSplitter once deployed accepts payments","Token","Token",""
"passed","Tue Nov 23 15:53:05 GMT 2021","Tue Nov 23 15:53:10 GMT 2021","4764","","Contract: Create2 computeAddress","","Contract: Create2 computeAddress","computes the correct contract address with deployer","computes the correct contract address with deployer",""
"passed","Tue Nov 23 15:49:57 GMT 2021","Tue Nov 23 15:50:03 GMT 2021","6091","","Contract: ERC1967Proxy initialization without parameters payable when not sending balance","","Contract: ERC1967Proxy initialization without parameters payable when not sending balance","initializes the proxy","initializes the proxy",""
"passed","Tue Nov 23 15:50:22 GMT 2021","Tue Nov 23 15:50:32 GMT 2021","10312","","Contract: ProxyAdmin #upgrade with unauthorized account","","Contract: ProxyAdmin #upgrade with unauthorized account","fails to upgrade","fails to upgrade",""
"passed","Tue Nov 23 15:52:13 GMT 2021","Tue Nov 23 15:52:19 GMT 2021","5827","","Contract: SignedSafeMath mul","","Contract: SignedSafeMath mul","multiplies by zero correctly","multiplies by zero correctly",""
"passed","Tue Nov 23 15:51:49 GMT 2021","Tue Nov 23 15:52:01 GMT 2021","12531","","Contract: EnumerableMap set","","Contract: EnumerableMap set","adds several keys","adds several keys",""
"passed","Tue Nov 23 15:51:25 GMT 2021","Tue Nov 23 15:51:29 GMT 2021","3784","","Contract: SafeMath with flag mul","","Contract: SafeMath with flag mul","multiplies by zero correctly","multiplies by zero correctly",""
"passed","Tue Nov 23 15:50:40 GMT 2021","Tue Nov 23 15:50:44 GMT 2021","4738","","Contract: MerkleProof verify","","Contract: MerkleProof verify","returns false for an invalid Merkle proof","returns false for an invalid Merkle proof",""
"passed","Tue Nov 23 15:51:48 GMT 2021","Tue Nov 23 15:51:53 GMT 2021","4602","","Contract: SignedSafeMath sub","","Contract: SignedSafeMath sub","subtracts correctly if it does not overflow and the result is positive","subtracts correctly if it does not overflow and the result is positive",""
"passed","Tue Nov 23 15:53:00 GMT 2021","Tue Nov 23 15:53:05 GMT 2021","4773","","Contract: SafeCast toUint128","","Contract: SafeCast toUint128","downcasts 0","downcasts 0",""
"passed","Tue Nov 23 15:54:18 GMT 2021","Tue Nov 23 15:54:24 GMT 2021","6022","","Contract: StorageSlot address storage slot","","Contract: StorageSlot address storage slot","set","set",""
"broken","Tue Nov 23 15:52:42 GMT 2021","Tue Nov 23 15:53:12 GMT 2021","30725","","Contract: EnumerableMap remove","","Contract: EnumerableMap remove","adds and removes multiple keys","adds and removes multiple keys",""
"passed","Tue Nov 23 15:49:53 GMT 2021","Tue Nov 23 15:50:01 GMT 2021","7859","","Contract: Initializable complex testing with inheritance","","Contract: Initializable complex testing with inheritance","initializes father","initializes father",""
"passed","Tue Nov 23 15:52:26 GMT 2021","Tue Nov 23 15:52:34 GMT 2021","8176","","Contract: BitMap set","","Contract: BitMap set","adds a key","adds a key",""
"passed","Tue Nov 23 15:49:31 GMT 2021","Tue Nov 23 15:49:36 GMT 2021","5681","","Contract: ERC1967Proxy without initialization when sending some balance","","Contract: ERC1967Proxy without initialization when sending some balance","initializes the proxy","initializes the proxy",""
"failed","Tue Nov 23 15:52:22 GMT 2021","Tue Nov 23 15:52:31 GMT 2021","8453","","Contract: Clones cloneDeterministic initialization without parameters payable when sending some balance","","Contract: Clones cloneDeterministic initialization without parameters payable when sending some balance","has expected balance","has expected balance",""
"skipped","Tue Nov 23 15:47:39 GMT 2021","Tue Nov 23 15:47:39 GMT 2021","0","","Contract: TimelockController usage scenario","","Contract: TimelockController usage scenario","call nonpayable with eth","call nonpayable with eth",""
"passed","Tue Nov 23 15:53:31 GMT 2021","Tue Nov 23 15:53:39 GMT 2021","7610","","Contract: Escrow as an escrow deposits","","Contract: Escrow as an escrow deposits","can accept a single deposit","can accept a single deposit",""
"passed","Tue Nov 23 15:55:07 GMT 2021","Tue Nov 23 15:55:17 GMT 2021","9475","","Contract: Address functionDelegateCall","","Contract: Address functionDelegateCall","reverts when address is not a contract","reverts when address is not a contract",""
"passed","Tue Nov 23 15:51:48 GMT 2021","Tue Nov 23 15:51:52 GMT 2021","4565","","Contract: Math ceilDiv","","Contract: Math ceilDiv","does not overflow","does not overflow",""
"failed","Tue Nov 23 15:50:42 GMT 2021","Tue Nov 23 15:50:47 GMT 2021","4985","","Contract: ERC165 Contract interface ERC165 ERC165's supportsInterface(bytes4)","","Contract: ERC165 Contract interface ERC165 ERC165's supportsInterface(bytes4)","uses less than 30k gas [skip-on-coverage]","uses less than 30k gas [skip-on-coverage]",""
"broken","Tue Nov 23 15:53:55 GMT 2021","Tue Nov 23 15:54:01 GMT 2021","5361","","Contract: Escrow as an escrow deposits","","Contract: Escrow as an escrow deposits","can add multiple deposits on a single account","can add multiple deposits on a single account",""
"skipped","Tue Nov 23 15:47:39 GMT 2021","Tue Nov 23 15:47:39 GMT 2021","0","","Contract: TimelockController methods batch execute with scheduled operation on time","","Contract: TimelockController methods batch execute with scheduled operation on time","length mismatch #2","length mismatch #2",""
"passed","Tue Nov 23 15:52:44 GMT 2021","Tue Nov 23 15:52:49 GMT 2021","4377","","Contract: SignedSafeMath div","","Contract: SignedSafeMath div","reverts on division by zero","reverts on division by zero",""
"failed","Tue Nov 23 15:53:24 GMT 2021","Tue Nov 23 15:53:26 GMT 2021","2116","","Contract: RefundEscrow","","Contract: RefundEscrow","requires a non-null beneficiary","requires a non-null beneficiary",""
"passed","Tue Nov 23 15:52:40 GMT 2021","Tue Nov 23 15:52:49 GMT 2021","8944","","Contract: Clones cloneDeterministic initialization with parameters non payable when not sending balance","","Contract: Clones cloneDeterministic initialization with parameters non payable when not sending balance","has expected balance","has expected balance",""
"passed","Tue Nov 23 15:50:42 GMT 2021","Tue Nov 23 15:50:50 GMT 2021","8322","","Contract: Clones clone initialization with parameters payable when not sending balance","","Contract: Clones clone initialization with parameters payable when not sending balance","has expected balance","has expected balance",""
"passed","Tue Nov 23 15:50:53 GMT 2021","Tue Nov 23 15:51:05 GMT 2021","11645","","Contract: TransparentUpgradeableProxy initialization without parameters payable when not sending balance","","Contract: TransparentUpgradeableProxy initialization without parameters payable when not sending balance","has expected balance","has expected balance",""
"skipped","Tue Nov 23 15:49:31 GMT 2021","Tue Nov 23 15:49:31 GMT 2021","0","","Contract: ERC1967Proxy without initialization when sending some balance","","Contract: ERC1967Proxy without initialization when sending some balance","sets the implementation address","sets the implementation address",""
"passed","Tue Nov 23 15:54:24 GMT 2021","Tue Nov 23 15:54:30 GMT 2021","6424","","Contract: StorageSlot address storage slot get","","Contract: StorageSlot address storage slot get","from right slot","from right slot",""
"passed","Tue Nov 23 15:53:31 GMT 2021","Tue Nov 23 15:53:40 GMT 2021","9923","","Contract: ConditionalEscrow when withdrawal is disallowed","","Contract: ConditionalEscrow when withdrawal is disallowed","reverts on withdrawals","reverts on withdrawals",""
"skipped","Tue Nov 23 15:49:46 GMT 2021","Tue Nov 23 15:49:46 GMT 2021","0","","Contract: TransparentUpgradeableProxy without initialization when sending some balance","","Contract: TransparentUpgradeableProxy without initialization when sending some balance","sets the implementation address","sets the implementation address",""
"passed","Tue Nov 23 15:53:32 GMT 2021","Tue Nov 23 15:53:38 GMT 2021","6353","","Contract: EnumerableMap read get with message","","Contract: EnumerableMap read get with message","missing value","missing value",""
"skipped","Tue Nov 23 15:48:16 GMT 2021","Tue Nov 23 15:48:16 GMT 2021","0","tests.hardhat","test_hardhat","","","","test_hardhat_simple",""
"passed","Tue Nov 23 15:54:02 GMT 2021","Tue Nov 23 15:54:14 GMT 2021","12072","","Contract: Address functionStaticCall","","Contract: Address functionStaticCall","calls the requested function","calls the requested function",""
"passed","Tue Nov 23 15:52:05 GMT 2021","Tue Nov 23 15:52:17 GMT 2021","12185","","Contract: TransparentUpgradeableProxy initialization with parameters payable when not sending balance","","Contract: TransparentUpgradeableProxy initialization with parameters payable when not sending balance","initializes the proxy","initializes the proxy",""
"passed","Tue Nov 23 15:52:17 GMT 2021","Tue Nov 23 15:52:27 GMT 2021","10165","","Contract: EnumerableSet EnumerableBytes32Set remove","","Contract: EnumerableSet EnumerableBytes32Set remove","removes added values","removes added values",""
"passed","Tue Nov 23 15:54:27 GMT 2021","Tue Nov 23 15:54:36 GMT 2021","9184","","Contract: Address functionStaticCall","","Contract: Address functionStaticCall","bubbles up revert reason","bubbles up revert reason",""
"passed","Tue Nov 23 15:52:47 GMT 2021","Tue Nov 23 15:52:56 GMT 2021","8897","","Contract: Address functionCall with valid contract receiver","","Contract: Address functionCall with valid contract receiver","reverts when the called function reverts with no reason","reverts when the called function reverts with no reason",""
"skipped","Tue Nov 23 15:47:39 GMT 2021","Tue Nov 23 15:47:39 GMT 2021","0","","Contract: TimelockController methods batch execute with scheduled operation","","Contract: TimelockController methods batch execute with scheduled operation","revert if execution comes too early 2/2","revert if execution comes too early 2/2",""
"passed","Tue Nov 23 15:52:07 GMT 2021","Tue Nov 23 15:52:12 GMT 2021","4840","","Contract: SafeCast toUint32","","Contract: SafeCast toUint32","reverts when downcasting 2^32 + 1 (4294967297)","reverts when downcasting 2^32 + 1 (4294967297)",""
"passed","Tue Nov 23 15:54:38 GMT 2021","Tue Nov 23 15:54:43 GMT 2021","5685","","Contract: StorageSlot bytes32 storage slot","","Contract: StorageSlot bytes32 storage slot","set","set",""
"failed","Tue Nov 23 15:46:22 GMT 2021","Tue Nov 23 15:46:24 GMT 2021","1837","","Contract: PaymentSplitter","","Contract: PaymentSplitter","rejects null payees","rejects null payees",""
"passed","Tue Nov 23 15:53:38 GMT 2021","Tue Nov 23 15:53:45 GMT 2021","6513","","Contract: EnumerableMap read tryGet","","Contract: EnumerableMap read tryGet","existing value","existing value",""
"broken","Tue Nov 23 15:44:23 GMT 2021","Tue Nov 23 15:44:23 GMT 2021","488","Ethers.js","","","","","testSigningMessages",""
"passed","Tue Nov 23 15:53:48 GMT 2021","Tue Nov 23 15:53:55 GMT 2021","6946","","Contract: RefundEscrow once deployed active state","","Contract: RefundEscrow once deployed active state","accepts deposits","accepts deposits",""
"passed","Tue Nov 23 15:52:30 GMT 2021","Tue Nov 23 15:52:36 GMT 2021","6543","","Contract: Arrays findUpperBound Even number of elements","","Contract: Arrays findUpperBound Even number of elements","returns 0 for the element under the lower boundary","returns 0 for the element under the lower boundary",""
"passed","Tue Nov 23 15:52:03 GMT 2021","Tue Nov 23 15:52:10 GMT 2021","7101","","Contract: Arrays findUpperBound Even number of elements","","Contract: Arrays findUpperBound Even number of elements","returns correct index for the basic case","returns correct index for the basic case",""
"passed","Tue Nov 23 15:50:33 GMT 2021","Tue Nov 23 15:50:41 GMT 2021","7639","","Contract: EIP712","","Contract: EIP712","domain separator","domain separator",""
"passed","Tue Nov 23 15:52:40 GMT 2021","Tue Nov 23 15:52:44 GMT 2021","4676","","Contract: SignedSafeMath div","","Contract: SignedSafeMath div","returns complete number result on non-even division","returns complete number result on non-even division",""
"passed","Tue Nov 23 15:52:43 GMT 2021","Tue Nov 23 15:52:50 GMT 2021","6901","","Contract: Arrays findUpperBound Odd number of elements","","Contract: Arrays findUpperBound Odd number of elements","returns 0 for the first element","returns 0 for the first element",""
"passed","Tue Nov 23 15:49:23 GMT 2021","Tue Nov 23 15:49:32 GMT 2021","9456","","Contract: UUPSUpgradeable","","Contract: UUPSUpgradeable","upgrade to upgradeable implementation","upgrade to upgradeable implementation",""
"skipped","Tue Nov 23 15:47:39 GMT 2021","Tue Nov 23 15:47:39 GMT 2021","0","","Contract: TimelockController methods batch execute with scheduled operation on time","","Contract: TimelockController methods batch execute with scheduled operation on time","executor can reveal","executor can reveal",""
"passed","Tue Nov 23 15:50:34 GMT 2021","Tue Nov 23 15:50:43 GMT 2021","9006","","Contract: TimersBlockNumber","","Contract: TimersBlockNumber","unset","unset",""
"passed","Tue Nov 23 15:51:17 GMT 2021","Tue Nov 23 15:51:20 GMT 2021","3730","","Contract: ERC165Storage Contract interface ERC165 supportsInterface(bytes4)","","Contract: ERC165Storage Contract interface ERC165 supportsInterface(bytes4)","has to be implemented","has to be implemented",""
"skipped","Tue Nov 23 15:52:05 GMT 2021","Tue Nov 23 15:52:05 GMT 2021","0","","Contract: TransparentUpgradeableProxy initialization with parameters payable when not sending balance","","Contract: TransparentUpgradeableProxy initialization with parameters payable when not sending balance","sets the implementation address","sets the implementation address",""
"broken","Tue Nov 23 15:53:10 GMT 2021","Tue Nov 23 15:53:12 GMT 2021","2747","","Contract: Create2 deploy","","Contract: Create2 deploy","deploys a ERC1820Implementer from inline assembly code","deploys a ERC1820Implementer from inline assembly code",""
"passed","Tue Nov 23 15:52:03 GMT 2021","Tue Nov 23 15:52:12 GMT 2021","8788","","Contract: Address isContract","","Contract: Address isContract","returns true for contract address","returns true for contract address",""
"passed","Tue Nov 23 15:52:59 GMT 2021","Tue Nov 23 15:53:04 GMT 2021","4845","","Contract: SafeMath with default revert message div","","Contract: SafeMath with default revert message div","divides zero correctly","divides zero correctly",""
"skipped","Tue Nov 23 15:47:39 GMT 2021","Tue Nov 23 15:47:39 GMT 2021","0","","Contract: TimelockController methods batch schedule","","Contract: TimelockController methods batch schedule","prevent overwritting active operation","prevent overwritting active operation",""
"passed","Tue Nov 23 15:49:33 GMT 2021","Tue Nov 23 15:49:41 GMT 2021","8507","","Contract: Clones clone initialization without parameters payable when not sending balance","","Contract: Clones clone initialization without parameters payable when not sending balance","initializes the proxy","initializes the proxy",""
"passed","Tue Nov 23 15:49:25 GMT 2021","Tue Nov 23 15:49:35 GMT 2021","10780","","Contract: TransparentUpgradeableProxy without initialization when not sending balance","","Contract: TransparentUpgradeableProxy without initialization when not sending balance","initializes the proxy","initializes the proxy",""
"skipped","Tue Nov 23 15:47:39 GMT 2021","Tue Nov 23 15:47:39 GMT 2021","0","","Contract: TimelockController maintenance","","Contract: TimelockController maintenance","prevent unauthorized maintenance","prevent unauthorized maintenance",""
"passed","Tue Nov 23 15:51:04 GMT 2021","Tue Nov 23 15:51:10 GMT 2021","5163","","Contract: SafeCast toUint8","","Contract: SafeCast toUint8","downcasts 1","downcasts 1",""
"broken","Tue Nov 23 15:50:22 GMT 2021","Tue Nov 23 15:50:33 GMT 2021","10431","","Contract: BeaconProxy initialization","","Contract: BeaconProxy initialization","non-payable initialization","non-payable initialization",""
"passed","Tue Nov 23 15:54:11 GMT 2021","Tue Nov 23 15:54:18 GMT 2021","7149","","Contract: StorageSlot boolean storage slot get","","Contract: StorageSlot boolean storage slot get","from other slot","from other slot",""
"failed","Tue Nov 23 15:48:50 GMT 2021","Tue Nov 23 15:49:01 GMT 2021","11284","tests.openzeppelin","test_openzeppelin","","","","test_contracts[input_data3]",""
"passed","Tue Nov 23 15:47:31 GMT 2021","Tue Nov 23 15:47:37 GMT 2021","6057","","Contract: MinimalForwarder with message verify invalid signature","","Contract: MinimalForwarder with message verify invalid signature","tampered data","tampered data",""
"passed","Tue Nov 23 15:47:03 GMT 2021","Tue Nov 23 15:47:15 GMT 2021","11694","","Contract: MinimalForwarder with message verify invalid signature","","Contract: MinimalForwarder with message verify invalid signature","tampered to","tampered to",""
"failed","Tue Nov 23 15:54:14 GMT 2021","Tue Nov 23 15:54:27 GMT 2021","12197","","Contract: Address functionStaticCall","","Contract: Address functionStaticCall","reverts on a non-static function","reverts on a non-static function",""
"passed","Tue Nov 23 15:53:46 GMT 2021","Tue Nov 23 15:53:51 GMT 2021","4994","","Contract: Counters","","Contract: Counters","starts at zero","starts at zero",""
"skipped","Tue Nov 23 15:50:08 GMT 2021","Tue Nov 23 15:50:08 GMT 2021","0","","Contract: ERC1967Proxy initialization without parameters payable when sending some balance","","Contract: ERC1967Proxy initialization without parameters payable when sending some balance","sets the implementation address","sets the implementation address",""
"skipped","Tue Nov 23 15:47:39 GMT 2021","Tue Nov 23 15:47:39 GMT 2021","0","","Contract: TimelockController dependency","","Contract: TimelockController dependency","can execute after dependency","can execute after dependency",""
"passed","Tue Nov 23 15:51:34 GMT 2021","Tue Nov 23 15:51:39 GMT 2021","4654","","Contract: SafeCast toUint16","","Contract: SafeCast toUint16","downcasts 2^16 - 1 (65535)","downcasts 2^16 - 1 (65535)",""
"passed","Tue Nov 23 15:49:17 GMT 2021","Tue Nov 23 15:49:26 GMT 2021","8606","","Contract: UpgradeableBeacon once deployed","","Contract: UpgradeableBeacon once deployed","returns implementation","returns implementation",""
